<?xml version='1.0' encoding='UTF-8'?>
<!DOCTYPE dataset SYSTEM "iDART.dtd">
<dataset>
  <atccode id="0" name="Metisazone" code="J05AA01"/>
  <atccode id="1" name="Aciclovir" code="J05AB01"/>
  <atccode id="2" name="Idoxuridine" code="J05AB02"/>
  <atccode id="3" name="Vidarabine" code="J05AB03"/>
  <atccode id="4" name="Ribavirin" code="J05AB04"/>
  <atccode id="5" name="Ganciclovir" code="J05AB06"/>
  <atccode id="6" name="Famciclovir" code="J05AB09"/>
  <atccode id="7" name="Valaciclovir" code="J05AB11"/>
  <atccode id="8" name="Cidofovir" code="J05AB12"/>
  <atccode id="9" name="Penciclovir" code="J05AB13"/>
  <atccode id="10" name="Valganciclov" code="J05AB14"/>
  <atccode id="11" name="Brivudine" code="J05AB15"/>
  <atccode id="12" name="Rimantadine" code="J05AC02"/>
  <atccode id="13" name="Tromantadine" code="J05AC03"/>
  <atccode id="14" name="Foscarnet" code="J05AD01"/>
  <atccode id="15" name="Fosfonet" code="J05AD02"/>
  <atccode id="16" name="Saquinavir" code="J05AE01"/>
  <atccode id="17" name="Indinavir" code="J05AE02"/>
  <atccode id="18" name="Ritonavir" code="J05AE03" mims="18.12"/>
  <atccode id="19" name="Nelfinavir" code="J05AE04" mims="19.12"/>
  <atccode id="20" name="Amprenavir" code="J05AE05"/>
  <atccode id="21" name="Lopinavir" code="J05AE06" mims="18.12"/>
  <atccode id="22" name="Fosamprenavir" code="J05AE07"/>
  <atccode id="23" name="Atazanavir" code="J05AE08"/>
  <atccode id="24" name="Tipranavir" code="J05AE09"/>
  <atccode id="25" name="Darunavir" code="J05AE10"/>
  <atccode id="26" name="Zidovudine" code="J05AF01" mims="18.12"/>
  <atccode id="27" name="Didanosine" code="J05AF02" mims="18.12"/>
  <atccode id="28" name="Zalcitabine" code="J05AF03"/>
  <atccode id="29" name="Stavudine" code="J05AF04" mims="18.12"/>
  <atccode id="30" name="Lamivudine" code="J05AF05" mims="18.9"/>
  <atccode id="31" name="Abacavir" code="J05AF06" mims="19.12"/>
  <atccode id="32" name="Tenofovir disoproxil" code="J05AF07" mims="18.12"/>
  <atccode id="33" name="Adefovir dipivoxil" code="J05AF08"/>
  <atccode id="34" name="Emtricitabine" code="J05AF09"/>
  <atccode id="35" name="Entecavir" code="J05AF10"/>
  <atccode id="36" name="Telbivudine" code="J05AF11"/>
  <atccode id="37" name="Clevudine" code="J05AF12"/>
  <atccode id="38" name="Nevirapine" code="J05AG01" mims="18.12"/>
  <atccode id="39" name="Delavirdine" code="J05AG02"/>
  <atccode id="40" name="Efavirenz" code="J05AG03" mims="19.12"/>
  <atccode id="41" name="Etravirine" code="J05AG04"/>
  <atccode id="42" name="Zanamivir" code="J05AH01"/>
  <atccode id="43" name="Oseltamivir" code="J05AH02"/>
  <atccode id="44" name="Zidovudine and Lamivudine" code="J05AR01"/>
  <atccode id="45" name="Lamivudine and Abacavir" code="J05AR02"/>
  <atccode id="46" name="Tenofovir disoproxil and Emtricitabine" code="J05AR03"/>
  <atccode id="47" name="Zidovudine, Lamivudine and Abacavir" code="J05AR04"/>
  <atccode id="48" name="Zidovudine, Lamivudine and Nevirapine" code="J05AR05"/>
  <atccode id="49" name="Emtricitabine, Tenofovir disoproxil and Efavirenz" code="J05AR06"/>
  <atccode id="50" name="Stavudine, Lamivudine and Nevirapine" code="J05AR07"/>
  <atccode id="51" name="Moroxydine" code="J05AX01"/>
  <atccode id="52" name="Lysozyme" code="J05AX02"/>
  <atccode id="53" name="Inosine pranobex" code="J05AX05"/>
  <atccode id="54" name="Pleconaril" code="J05AX06"/>
  <atccode id="55" name="Enfuvirtide" code="J05AX07"/>
  <atccode id="56" name="Raltegravir" code="J05AX08"/>
  <atccode id="57" name="Maraviroc" code="J05AX09"/>
  <atccode id="58" name="Maribavir" code="J05AX10"/>
  <form id="1" form="Lozenges" actionlanguage1="Suck" actionlanguage2="Munca" actionlanguage3="Suig" formlanguage1="lozenge(s)" formlanguage2="" formlanguage3="" dispinstructions1=""/>
  <form id="2" form="Cream" actionlanguage1="Apply" actionlanguage2="Qaba" actionlanguage3="Wend aan" formlanguage1="" formlanguage2="" formlanguage3="" dispinstructions1=""/>
  <form id="3" form="Ointment" actionlanguage1="Apply" actionlanguage2="Qaba" actionlanguage3="Wend aan" formlanguage1="" formlanguage2="" formlanguage3="" dispinstructions1=""/>
  <form id="4" form="Gel" actionlanguage1="Apply" actionlanguage2="Qaba" actionlanguage3="Wend aan" formlanguage1="" formlanguage2="" formlanguage3="" dispinstructions1=""/>
  <form id="5" form="Oral Gel" actionlanguage1="Apply" actionlanguage2="Qaba" actionlanguage3="Wend aan" formlanguage1="" formlanguage2="" formlanguage3="" dispinstructions1="to the mouth / emlonyeni"/>
  <form id="6" form="Lotion" actionlanguage1="Apply" actionlanguage2="Qaba" actionlanguage3="Wend aan" formlanguage1="" formlanguage2="" formlanguage3="" dispinstructions1=""/>
  <form id="7" form="Vaginal Cream" actionlanguage1="Insert" actionlanguage2="Faka" actionlanguage3="Steek in" formlanguage1="" formlanguage2="" formlanguage3="" dispinstructions1="Vaginal Cream / Isithambiso sangaphantsi"/>
  <form id="8" form="Eye Ointment" actionlanguage1="Apply" actionlanguage2="Qaba" actionlanguage3="Wend aan" formlanguage1="" formlanguage2="" formlanguage3="" dispinstructions1="to __ eye(s)"/>
  <form id="9" form="Suppository" actionlanguage1="Insert" actionlanguage2="Faka" actionlanguage3="Steek in" formlanguage1="suppository" formlanguage2="" formlanguage3="" dispinstructions1=""/>
  <form id="10" form="Nose drops" actionlanguage1="Instill" actionlanguage2="Galela" actionlanguage3="Gebruik" formlanguage1="drops" formlanguage2="amathontsi" formlanguage3="druppel(s)" dispinstructions1="in each nostril"/>
  <form id="11" form="Eye drops" actionlanguage1="Instill" actionlanguage2="Galela" actionlanguage3="Gebruik" formlanguage1="drops" formlanguage2="amathontsi" formlanguage3="druppel(s)" dispinstructions1="in __ eye(s)"/>
  <form id="12" form="Ear drops" actionlanguage1="Instill" actionlanguage2="Galela" actionlanguage3="Gebruik" formlanguage1="drops" formlanguage2="amathontsi" formlanguage3="druppel(s)" dispinstructions1="in __ ear(s)"/>
  <form id="13" form="Soap" actionlanguage1="Wash with soap" actionlanguage2="Hlamba nge sepa" actionlanguage3="Was met seep" formlanguage1="" formlanguage2="" formlanguage3="" dispinstructions1=""/>
  <form id="14" form="Tablets" actionlanguage1="Take" actionlanguage2="Sela" actionlanguage3="Neem" formlanguage1="tablets" formlanguage2="ipilisi" formlanguage3="pille" dispinstructions1=""/>
  <form id="15" form="Suspension" actionlanguage1="Take" actionlanguage2="Sela" actionlanguage3="Neem" formlanguage1="ml" formlanguage2="ml" formlanguage3="ml" dispinstructions1=""/>
  <form id="16" form="Syrup" actionlanguage1="Take" actionlanguage2="Sela" actionlanguage3="Neem" formlanguage1="ml" formlanguage2="ml" formlanguage3="ml" dispinstructions1=""/>
  <form id="17" form="Capsules" actionlanguage1="Take" actionlanguage2="Sela" actionlanguage3="Neem" formlanguage1="capsules" formlanguage2="ipilisi" formlanguage3="pille" dispinstructions1=""/>
  <drug id="1" form="16" dispensinginstructions1="" dispensinginstructions2="" modified="T" name="[ABC] Abacavir 20mg/ml" packsize="240" sidetreatment="F" defaultamnt="0.0" defaulttimes="2" stockcode="" atccode_id="31"/>
  <drug id="2" form="14" dispensinginstructions1="" dispensinginstructions2="" modified="T" name="[ABC] Abacavir 300mg" packsize="60" sidetreatment="F" defaultamnt="1.0" defaulttimes="2" stockcode="" atccode_id="31"/>
  <drug id="3" form="14" dispensinginstructions1="" dispensinginstructions2="" modified="T" name="[TDF] Tenofovir 300mg" packsize="30" sidetreatment="F" defaultamnt="1.0" defaulttimes="1" stockcode="" atccode_id="32"/>
  <drug id="4" form="14" dispensinginstructions1="Take on an empty stomach" dispensinginstructions2="" modified="T" name="[DDI] Didanosine 25mg" packsize="60" sidetreatment="F" defaultamnt="0.0" defaulttimes="2" stockcode="" atccode_id="27"/>
  <drug id="5" form="14" dispensinginstructions1="Take on an empty stomach" dispensinginstructions2="" modified="T" name="[DDI] Didanosine 50mg" packsize="60" sidetreatment="F" defaultamnt="0.0" defaulttimes="2" stockcode="" atccode_id="27"/>
  <drug id="6" form="17" dispensinginstructions1="Take at night only" dispensinginstructions2="" modified="T" name="[EFV] Efavirenz 200mg" packsize="90" sidetreatment="F" defaultamnt="0.0" defaulttimes="1" stockcode="" atccode_id="40"/>
  <drug id="7" form="17" dispensinginstructions1="Take at night only" dispensinginstructions2="" modified="T" name="[EFV] Efavirenz 50mg" packsize="30" sidetreatment="F" defaultamnt="0.0" defaulttimes="1" stockcode="" atccode_id="40"/>
  <drug id="8" form="14" dispensinginstructions1="Take at night only" dispensinginstructions2="" modified="T" name="[EFV] Efavirenz 600mg" packsize="30" sidetreatment="F" defaultamnt="1.0" defaulttimes="1" stockcode="" atccode_id="40"/>
  <drug id="9" form="16" dispensinginstructions1="" dispensinginstructions2="" modified="T" name="[3TC] Lamivudine 10mg/ml" packsize="240" sidetreatment="F" defaultamnt="0.0" defaulttimes="2" stockcode="" atccode_id="30"/>
  <drug id="10" form="14" dispensinginstructions1="" dispensinginstructions2="" modified="T" name="[3TC] Lamivudine 150mg" packsize="60" sidetreatment="F" defaultamnt="1.0" defaulttimes="2" stockcode="" atccode_id="30"/>
  <drug id="11" form="14" dispensinginstructions1="" dispensinginstructions2="" modified="T" name="[NVP] Nevirapine 200mg" packsize="60" sidetreatment="F" defaultamnt="1.0" defaulttimes="2" stockcode="" atccode_id="38"/>
  <drug id="12" form="16" dispensinginstructions1="" dispensinginstructions2="" modified="T" name="[NVP] Nevirapine 50mg/5ml" packsize="240" sidetreatment="F" defaultamnt="0.0" defaulttimes="2" stockcode="" atccode_id="38"/>
  <drug id="13" form="16" dispensinginstructions1="" dispensinginstructions2="" modified="T" name="[RTV] Ritonavir 80mg/ml" packsize="90" sidetreatment="F" defaultamnt="0.0" defaulttimes="2" stockcode="" atccode_id="18"/>